{"schema_version":1,"id":"y2_autumn_memory_market_dialogue","title":"記憶市集","start_node":"start","characters":["hero","eira"],"nodes":[{"id":"start","type":"line","speaker":"eira","text":"先祖的歌不賣給陌生人。當你真正理解村裡一顆心，再帶著那份信任走到第三十層。","next":"answer"},{"id":"answer","type":"choice","options":[{"text":"我會帶回一段值得記住的歌。","next":"accept"},{"text":"信任不能勉強。","next":"later"}]},{"id":"accept","type":"action","actions":[{"type":"quest","quest_id":"y2_autumn_memory_market_quest","state":"active"}],"next":"end"},{"id":"later","type":"line","speaker":"eira","text":"正因如此，它才比金幣貴重。","next":"end"},{"id":"end","type":"end"}]}
