{"schema_version":1,"id":"y3_summer_bell_makers_dialogue","title":"造鐘者們","start_node":"start","characters":["hero","soren"],"nodes":[{"id":"start","type":"line","speaker":"soren","text":"十雙手完成了共鳴器，最後只缺你從第四十層帶回的冬音。這不是某位英雄的鐘，是整座村莊的。","next":"answer"},{"id":"answer","type":"choice","options":[{"text":"那就讓所有人的聲音抵達最深處。","next":"accept"},{"text":"我會先磨利刀鋒。","next":"later"}]},{"id":"accept","type":"action","actions":[{"type":"quest","quest_id":"y3_summer_bell_makers_quest","state":"active"}],"next":"end"},{"id":"later","type":"line","speaker":"soren","text":"去吧。鐘舌完成前，我也不會休息。","next":"end"},{"id":"end","type":"end"}]}
