{"schema_version":1,"id":"y3_autumn_last_seal_dialogue","title":"最後的封印","start_node":"start","characters":["hero","lian"],"nodes":[{"id":"start","type":"line","speaker":"lian","text":"冬鐘守望者把最後一枚封印藏在自己胸口。四季都齊了，霧才會承認時間仍在前進。","next":"answer"},{"id":"answer","type":"choice","options":[{"text":"我要完成四季的和弦。","next":"accept"},{"text":"最後一程更不能急。","next":"later"}]},{"id":"accept","type":"action","actions":[{"type":"quest","quest_id":"y3_autumn_last_seal_quest","state":"active"}],"next":"end"},{"id":"later","type":"line","speaker":"lian","text":"我會守在洞口，直到你回來。","next":"end"},{"id":"end","type":"end"}]}
