{"schema_version":1,"id":"y1_spring_new_soil_dialogue","title":"第一穗與鐘腹空洞","start_node":"start","characters":["hero","mira","toma","piko"],"nodes":[{"id":"start","type":"line","speaker":"mira","text":"第一穗發芽時，地下傳來空鐘聲。這片田不是遺產，是鐘塔留給我們的入口。","next":"clue"},{"id":"clue","type":"line","speaker":"toma","text":"皮可在穀倉找到半張鐘輪草圖。先去認識村裡的人；另一半可能藏在誰的舊故事裡。","next":"answer"},{"id":"answer","type":"choice","options":[{"text":"我會種出第一籃，也會記住大家的名字。","next":"accept"},{"text":"讓我先熟悉農場與村路。","next":"later"}]},{"id":"accept","type":"action","actions":[{"type":"quest","quest_id":"y1_spring_new_soil_quest","state":"active"}],"next":"end"},{"id":"later","type":"line","speaker":"piko","text":"慢慢來！土地和朋友都不會因為換季而消失。","next":"end"},{"id":"end","type":"end"}]}
