{"schema_version":1,"id":"y3_winter_bell_reborn_dialogue","title":"鐘聲重生","start_node":"start","characters":["hero","mira"],"nodes":[{"id":"start","type":"line","speaker":"mira","text":"核心問的從來不是誰能征服它，而是誰願意讓時間再次流動——即使流動意味著改變。","next":"answer"},{"id":"answer","type":"choice","options":[{"text":"讓鐘聲回來，讓每個明天都能不同。","next":"accept"},{"text":"我想再走一遍村莊。","next":"later"}]},{"id":"accept","type":"action","actions":[{"type":"quest","quest_id":"y3_winter_bell_reborn_quest","state":"active"}],"next":"end"},{"id":"later","type":"line","speaker":"mira","text":"去吧。沒有期限，正是我們一起守住的答案。","next":"end"},{"id":"end","type":"end"}]}
