{"schema_version":1,"id":"y2_winter_third_seal_dialogue","title":"第三鐘影與同行之人","start_node":"start","characters":["hero","yuna","asha","eira"],"nodes":[{"id":"start","type":"line","speaker":"yuna","text":"診所舊名冊在第三十層停住。失蹤者不是戰敗，而是聽見最想念的人呼喚，走錯了門。","next":"clue"},{"id":"clue","type":"line","speaker":"asha","text":"帶著一段八心羈絆下去。不必是戀人；真正認識你的人，才能在鐘影裡叫回你的名字。","next":"answer"},{"id":"answer","type":"choice","options":[{"text":"我會和重要的人說清楚，再去第三十層。","next":"accept"},{"text":"我先聽完村民的故事。","next":"later"}]},{"id":"accept","type":"action","actions":[{"type":"quest","quest_id":"y2_winter_third_seal_quest","state":"active"}],"next":"end"},{"id":"later","type":"line","speaker":"eira","text":"羈絆不是每日簽到。你準備好時，我們都在村裡。","next":"end"},{"id":"end","type":"end"}]}
