{"schema_version":1,"id":"y1_autumn_shared_harvest_dialogue","title":"河燈下的無星鱗","start_node":"start","characters":["hero","lian","yuna","nori"],"nodes":[{"id":"start","type":"line","speaker":"lian","text":"普通魚的影子跟著月亮，昨晚那一尾卻把月光吃掉了。先釣幾尾熟悉河流，再等無星異潮。","next":"clue"},{"id":"clue","type":"line","speaker":"yuna","text":"異魚會消耗理智；回家睡覺就能恢復。你也可以同時認識不同的人，感情不該是第一場對話就被鎖死。","next":"answer"},{"id":"answer","type":"choice","options":[{"text":"我要理解魚群，也理解你們各自的心。","next":"accept"},{"text":"我會先從平潮練習。","next":"later"}]},{"id":"accept","type":"action","actions":[{"type":"quest","quest_id":"y1_autumn_shared_harvest_quest","state":"active"}],"next":"end"},{"id":"later","type":"line","speaker":"nori","text":"我把潮汐日寫在圖書館黑板：每季十三、二十三、三十日晚間。","next":"end"},{"id":"end","type":"end"}]}
