{"schema_version":1,"id":"y1_summer_tide_echo_dialogue","title":"潮聲中的裂紋","start_node":"start","characters":["hero","lian"],"nodes":[{"id":"start","type":"line","speaker":"lian","text":"河床下傳來不屬於水流的回音。第十層的春根守護者正握著第一枚封印。","next":"answer"},{"id":"answer","type":"choice","options":[{"text":"我會帶回春之封印。","next":"accept"},{"text":"先讓我準備裝備。","next":"later"}]},{"id":"accept","type":"action","actions":[{"type":"quest","quest_id":"y1_summer_tide_echo_quest","state":"active"}],"next":"end"},{"id":"later","type":"line","speaker":"lian","text":"潮汐不催人，但它從不停止。","next":"end"},{"id":"end","type":"end"}]}
