{"schema_version":1,"id":"y1_winter_frozen_note_dialogue","title":"冰封的音符","start_node":"start","characters":["hero","yuna"],"nodes":[{"id":"start","type":"line","speaker":"yuna","text":"霜把舊鐘圖封在診所地下。先學會為長冬補給；能照顧自己的人，才走得進更深的霧。","next":"answer"},{"id":"answer","type":"choice","options":[{"text":"我會準備好再出發。","next":"accept"},{"text":"我想先享受這場雪。","next":"later"}]},{"id":"accept","type":"action","actions":[{"type":"quest","quest_id":"y1_winter_frozen_note_quest","state":"active"}],"next":"end"},{"id":"later","type":"line","speaker":"yuna","text":"很好，休息本來就是準備的一部分。","next":"end"},{"id":"end","type":"end"}]}
